{
  "id": "dev.bdg.osu-export",
  "repo": "beat-data-generator/bdg_plugin_osu",
  "author": "BUGJI",
  "categories": ["export"],
  "tags": ["osu", "mania", "rhythm"],
  "minAppVersion": "0.2.15",
  "name": {
    "zh": "osu!mania 导出",
    "en": "osu!mania Export"
  },
  "description": {
    "zh": "把踩点导出为 osu!mania 谱面（.osu）。面板里填写元数据、选择 7K/8K/16K 等键数并把每条轨道映射到列，同一时刻的多轨踩点自动成为多押。",
    "en": "Export markers as an osu!mania beatmap (.osu). Configure metadata, pick a key count (7K/8K/16K ...), map each track to a column; simultaneous markers on different tracks become chords."
  },
  "versions": {}
}
