{
  "id": "dev.bdg.phira-converter",
  "repo": "beat-data-generator/bdg_plugin_phira",
  "author": "BUGJI",
  "categories": [
    "export"
  ],
  "tags": [
    "phira",
    "rpe",
    "rhythm"
  ],
  "minAppVersion": "0.2.15",
  "name": {
    "zh": "Phira 谱面转换器",
    "en": "Phira Chart Converter"
  },
  "description": {
    "zh": "把工程中的踩点(Tap)转换成 Phira/RPE 谱面，可选合并成单判定线模式，并连同音频打包为 .pez。",
    "en": "Convert project tap markers into a Phira/RPE chart, with optional single-judge-line merge mode, and pack it with the audio into a .pez."
  },
  "versions": {
    "0.1.0": {
      "url": "https://github.com/beat-data-generator/bdg_plugin_phira/releases/download/v0.1.0/plugin.zip",
      "sha256": "6d897fff6c00b8a4028af9783b333891b8620a6269b663da35c22001b66d6f2c",
      "size": 11039
    },
    "0.2.0": {
      "url": "https://github.com/beat-data-generator/bdg_plugin_phira/releases/download/v0.2.0/plugin.zip",
      "sha256": "f6ba535a0c8ca7fd035ee351c05c058ff83d2ca35ab03e2b8d88697519e303e2",
      "size": 12278
    }
  }
}
